{
  "$schema": "../level.schema.json",
  "version": 2,
  "grid": [
    ["",      "ES",    "EW",    "EW",    "EW",    "EW",    "EW",    "EW+SW", "EW",    "EW",    "EW",    "EW",    "EW",    "SW",    ""],
    ["",      "NS",    "",      "",      "",      "",      "",      "NS",    "",      "",      "",      "",      "",      "NS",    ""],
    ["",      "NS",    "",      "",      "",      "",      "",      "NS",    "",      "",      "",      "",      "",      "NS",    ""],
    ["",      "NS",    "",      "",      "",      "",      "",      "NS",    "",      "",      "",      "",      "",      "NS",    ""],
    ["",      "NS+ES", "EW",    "EW",    "EW",    "EW",    "EW",    "EW+NS", "EW",    "SW",    "",      "",      "",      "NS",    ""],
    ["",      "NS",    "",      "",      "",      "",      "",      "NS",    "",      "NS",    "",      "",      "",      "NS",    ""],
    ["",      "NS",    "",      "",      "",      "",      "",      "NS",    "",      "NS",    "",      "",      "",      "NS",    ""],
    ["",      "NS",    "",      "",      "",      "",      "",      "NS",    "",      "NS",    "",      "",      "",      "NS",    ""],
    ["",      "NE",    "EW",    "EW",    "EW",    "EW",    "EW",    "EW+NW", "EW",    "EW+NE", "EW",    "EW",    "EW",    "NW",    ""],
    ["",      "",      "",      "",      "",      "",      "",      "",      "",      "",      "",      "",      "",      "",      ""]
  ],
  "semaphores": [
    {"at":[9,6],"initial":"closed"},
    {"at":[3,4],"initial":"closed"}
  ],
  "trains": [
    {"at":[4,0],"heading":"E","wagons":["wagon1","wagon2"]}
  ],
  "station": [5,4]
}
